[
  {
    "id": "THEORY.00.WHAT_IS_CEM",
    "order": 0,
    "label": {
      "en": "What is the Cognitive Epistemic Model?",
      "ro": "Ce este Cognitive Epistemic Model?"
    },
    "summary": {
      "en": "Orientation to the problem CEM studies, the retained M0 baseline, the M1 extensions, and the model's current scientific limits.",
      "ro": "Orientare asupra problemei studiate de CEM, modelului executabil de referință M0, extensiilor M1 și limitelor științifice actuale ale modelului."
    },
    "source_paths": {
      "en": "docs/theory/en/00-what-is-cem.md",
      "ro": "docs/theory/ro/00-ce-este-cem.md"
    },
    "prerequisites": [],
    "epistemic_status": [
      "CONCEPTUAL",
      "EXECUTABLE"
    ],
    "module_ids": [
      "MOD.02",
      "MOD.14"
    ],
    "variable_ids": [],
    "mechanism_ids": [],
    "validation_ids": [],
    "evidence_refs": [],
    "sources": [
      {
        "role": "BACKGROUND_THEORY",
        "ref": "https://www.jasss.org/23/2/7.html"
      }
    ],
    "code_refs": [],
    "related_views": [
      "process",
      "reference"
    ],
    "anchors": [
      "central-idea",
      "current-model",
      "application",
      "limits"
    ],
    "what_it_does_not_claim": {
      "en": "CEM is not an empirically calibrated population model and does not diagnose individuals.",
      "ro": "CEM nu este un model populațional calibrat empiric și nu diagnostichează persoane."
    }
  },
  {
    "id": "THEORY.01.WORLD_INFORMATION_REPRESENTATION",
    "order": 1,
    "label": {
      "en": "World, information and internal representation",
      "ro": "Lume, informație și reprezentare internă"
    },
    "summary": {
      "en": "Separates world state, available information, selected and presented information, observed information, internal representation, judgment and action.",
      "ro": "Separă starea lumii, informația disponibilă, informația selectată și prezentată, informația observată, reprezentarea internă, judecata și acțiunea."
    },
    "source_paths": {
      "en": "docs/theory/en/01-world-information-representation.md",
      "ro": "docs/theory/ro/01-lume-informatie-reprezentare.md"
    },
    "prerequisites": [
      "THEORY.00.WHAT_IS_CEM"
    ],
    "epistemic_status": [
      "CONCEPTUAL",
      "EXECUTABLE"
    ],
    "module_ids": [
      "MOD.03",
      "MOD.14",
      "MOD.16"
    ],
    "variable_ids": [
      "VAR.OBSERVED.SAMPLE.BALANCE",
      "VAR.ISSUE.APPRAISAL"
    ],
    "mechanism_ids": [
      "editorial",
      "presentation"
    ],
    "validation_ids": [
      "VAL.M1.001",
      "VAL.M1.002"
    ],
    "evidence_refs": [
      "REF.TOHIDI.2025",
      "REF.ARUGUETE.2024"
    ],
    "sources": [
      {
        "role": "MODEL_EVIDENCE",
        "ref": "REF.TOHIDI.2025"
      },
      {
        "role": "MODEL_EVIDENCE",
        "ref": "REF.ARUGUETE.2024"
      },
      {
        "role": "BACKGROUND_THEORY",
        "ref": "https://doi.org/10.1016/j.neuron.2018.10.003"
      },
      {
        "role": "BACKGROUND_THEORY",
        "ref": "https://pmc.ncbi.nlm.nih.gov/articles/PMC7187369/"
      }
    ],
    "code_refs": [],
    "related_views": [
      "learning",
      "process",
      "reference"
    ],
    "anchors": [
      "central-idea",
      "causal-stages",
      "application",
      "limits"
    ],
    "what_it_does_not_claim": {
      "en": "The current CEM does not implement a neural predictive-coding model or a complete internal world model.",
      "ro": "CEM actual nu implementează un model neuronal de predictive coding și nici un model intern complet al lumii."
    }
  },
  {
    "id": "THEORY.02.PROCESSING_METACONTROL",
    "order": 2,
    "label": {
      "en": "Fast processing, deliberation and metacontrol",
      "ro": "Procesare rapidă, deliberare și metacontrol"
    },
    "summary": {
      "en": "Introduces cautious Type 1/Type 2 distinctions, working-memory demands and metacognitive control without turning them into two literal brains.",
      "ro": "Introduce prudent distincțiile Type 1/Type 2, rolul memoriei de lucru, al atenției și al metacontrolului, fără a le transforma în două sisteme cognitive literale."
    },
    "source_paths": {
      "en": "docs/theory/en/02-processing-metacontrol.md",
      "ro": "docs/theory/ro/02-procesare-metacontrol.md"
    },
    "prerequisites": [
      "THEORY.00.WHAT_IS_CEM"
    ],
    "epistemic_status": [
      "CONCEPTUAL"
    ],
    "module_ids": [
      "MOD.02",
      "MOD.09",
      "MOD.15"
    ],
    "variable_ids": [
      "VAR.ACCURACY.SALIENCE"
    ],
    "mechanism_ids": [],
    "validation_ids": [],
    "evidence_refs": [],
    "sources": [
      {
        "role": "BACKGROUND_THEORY",
        "ref": "https://doi.org/10.1177/1745691612460685"
      },
      {
        "role": "BACKGROUND_THEORY",
        "ref": "https://doi.org/10.1038/s44159-025-00466-6"
      }
    ],
    "code_refs": [],
    "related_views": [
      "learning",
      "reference"
    ],
    "anchors": [
      "central-idea",
      "theory",
      "application",
      "limits"
    ],
    "what_it_does_not_claim": {
      "en": "Accuracy salience W is not System 2 activation and CEM does not model two discrete cognitive systems.",
      "ro": "Saliența acurateții W nu este activarea Sistemului 2, iar CEM nu modelează două sisteme cognitive discrete."
    }
  },
  {
    "id": "THEORY.03.UNCERTAINTY_CLOSURE",
    "order": 3,
    "label": {
      "en": "Uncertainty, need for closure, seizing and freezing",
      "ro": "Incertitudine și nevoia de închidere cognitivă"
    },
    "summary": {
      "en": "Recovers the project's conceptual distinction between closure pressure, rapid commitment and later maintenance of an interpretation.",
      "ro": "Recuperează distincția conceptuală a proiectului dintre presiunea pentru închidere, angajarea rapidă și menținerea ulterioară a unei interpretări."
    },
    "source_paths": {
      "en": "docs/theory/en/03-uncertainty-closure.md",
      "ro": "docs/theory/ro/03-incertitudine-closure.md"
    },
    "prerequisites": [
      "THEORY.02.PROCESSING_METACONTROL"
    ],
    "epistemic_status": [
      "CONCEPTUAL"
    ],
    "module_ids": [
      "MOD.02",
      "MOD.06"
    ],
    "variable_ids": [],
    "mechanism_ids": [],
    "validation_ids": [],
    "evidence_refs": [],
    "sources": [
      {
        "role": "BACKGROUND_THEORY",
        "ref": "https://doi.org/10.1037/0033-295X.103.2.263"
      }
    ],
    "code_refs": [],
    "related_views": [
      "learning"
    ],
    "anchors": [
      "central-idea",
      "seizing-freezing",
      "application",
      "limits"
    ],
    "what_it_does_not_claim": {
      "en": "Track A and Track B are not measured population classes or biological types.",
      "ro": "Track A și Track B nu sunt clase populaționale măsurate și nici tipuri biologice."
    }
  },
  {
    "id": "THEORY.04.STRESS_RESOURCES_FLEXIBILITY",
    "order": 4,
    "label": {
      "en": "Stress, executive resources and flexibility",
      "ro": "Stres, resurse executive și flexibilitate"
    },
    "summary": {
      "en": "Explains how stress can affect working memory and flexibility while avoiding simplistic claims that stress switches off the prefrontal cortex.",
      "ro": "Explică modul în care stresul poate afecta memoria de lucru și flexibilitatea, evitând afirmația simplistă că stresul oprește cortexul prefrontal."
    },
    "source_paths": {
      "en": "docs/theory/en/04-stress-resources-flexibility.md",
      "ro": "docs/theory/ro/04-stres-resurse-flexibilitate.md"
    },
    "prerequisites": [
      "THEORY.02.PROCESSING_METACONTROL"
    ],
    "epistemic_status": [
      "EMPIRICAL",
      "CONCEPTUAL"
    ],
    "module_ids": [
      "MOD.01",
      "MOD.02",
      "MOD.06"
    ],
    "variable_ids": [],
    "mechanism_ids": [],
    "validation_ids": [],
    "evidence_refs": [],
    "sources": [
      {
        "role": "BACKGROUND_THEORY",
        "ref": "https://pmc.ncbi.nlm.nih.gov/articles/PMC5003767/"
      }
    ],
    "code_refs": [],
    "related_views": [
      "learning"
    ],
    "anchors": [
      "central-idea",
      "evidence",
      "application",
      "limits"
    ],
    "what_it_does_not_claim": {
      "en": "Alpha 0.4.1a1 introduces no stress coefficient and no stress-driven transition equation.",
      "ro": "Alpha 0.4.1a1 nu introduce niciun coeficient de stres și nicio ecuație de tranziție determinată de stres."
    }
  },
  {
    "id": "THEORY.05.REPETITION_FAMILIARITY_TRUTH",
    "order": 5,
    "label": {
      "en": "Repetition, familiarity and judged truth",
      "ro": "Repetiție, familiaritate și adevăr perceput"
    },
    "summary": {
      "en": "Explains the executable M0 path from repeated exposure to familiarity and its contribution to claim plausibility.",
      "ro": "Explică traseul executabil M0 de la expunerea repetată la familiaritate și contribuția acesteia la plauzibilitatea afirmației."
    },
    "source_paths": {
      "en": "docs/theory/en/05-repetition-familiarity-truth.md",
      "ro": "docs/theory/ro/05-repetitie-familiaritate-adevar.md"
    },
    "prerequisites": [
      "THEORY.01.WORLD_INFORMATION_REPRESENTATION"
    ],
    "epistemic_status": [
      "EMPIRICAL",
      "EXECUTABLE"
    ],
    "module_ids": [
      "MOD.03",
      "MOD.04",
      "MOD.02"
    ],
    "variable_ids": [
      "VAR.EXPOSURE.COUNT",
      "VAR.FAMILIARITY.CLAIM",
      "VAR.BELIEF.CLAIM"
    ],
    "mechanism_ids": [
      "repetition"
    ],
    "validation_ids": [
      "VAL.M0.001"
    ],
    "evidence_refs": [
      "REF.HASHER.1977",
      "REF.DECHENE.2010"
    ],
    "sources": [
      {
        "role": "MODEL_EVIDENCE",
        "ref": "REF.HASHER.1977"
      },
      {
        "role": "MODEL_EVIDENCE",
        "ref": "REF.DECHENE.2010"
      },
      {
        "role": "BACKGROUND_THEORY",
        "ref": "https://pubmed.ncbi.nlm.nih.gov/41760614/"
      },
      {